Comentario,Polaridad,Aspecto
la activacion de los objetos esta correctamente plasmada,1,activacion
no contiene numeracion alguna,-1,numeracion
el nombre del diagrama es adecuado la distribucion de los objetos es totalmente correcta lo que permite una mejor comprension,1,nombre
todos los objetos se encuentran identificados correctamente,1,objetos
la activacion de los objetos es bastante adecuada durante los lapsos de tiempo falta retornan en algunos casos despues de activar el objeto,0,activacion
los mensajes no poseen numeracion falta retornar mensajes cuando se activan los objetos los mensajes expresan funcionalidad,-1,mensajes
el nombre del diagrama es correcto la distribucion de todos los objetos es correcta los activaciones y mensajes contemplan una secuencia ordenada de inicio a fin,1,nombre
todos los objetos presentes en el diagrama tanto de reserva y automovil estan identificados correctamente,1,objetos
las activaciones se activan de manera correcta en el lapso de tiempo que les corresponde,1,activaciones
los mensajes no cuentan con ninguna numeracion las comunicaciones se realizan de manera adecuada los mensajes presenten el diagrama corresponden a las funcionalidades solicitadas en los requerimientos,1,mensajes
el diagrama posee un buen diseno lleva un orden que permite la facilidad de comprenderlo mejor,1,diagrama
el diagrama consta con todos los objetos como el actor interfaz control y la entidad,1,diagrama
las lineas de tiempo no constan con las funciones correctas,-1,lineas
los mensajes no lleva una enumeracion y no hay comunicacion de manera sincronica,-1,mensajes
el diagrama no cuenta con un nombre por lo que no se entiende a que proceso pertenece la distribucion de los objetos es adecuada y entendible,0,diagrama
todos los objetos involucrados se identifican de manera adecuada y estan bien distribuidos,1,objetos
la activacion de los objetos es adecuada la linea de activacion esta incompleta,0,activacion
no existe numeracion en los mensajes las comunicaciones se realizan de manera correcta los mensajes si muestran funcionalidad correcta pero no de todos los requerimientos solicitados,0,numeracion
el nombre del diagrama es medianamente adecuado,0,nombre
los objetos involucrados se identifican parcialmente correctos,0,objetos
la activacion de cada uno de los objetos no lo aplican correctamente durante el lapso de tiempo que corresponde,-1,activacion
la numeracion de los mensajes no existe la comunicacion sincronica o asincronica es correcta los mensajes indican medianamente la funcionalidad de los requerimientos descritos,0,numeracion
el nombre de diagrama es adecuado y facil de comprender la distribucion de sus componentes es correcta y funcional,1,nombre
los objetos involucrados se identifican parcialmente correctos,0,objetos
tiene una linea de tiempo de acuerdo con lo que se pide,1,linea
no estan numerados los mensajes la comunicacion sincronica es incorrecta,-1,mensajes
el diseno es un poco dificil de entender y no tiene nombre del diagrama,-1,diseno
se identifican los actores pero no tiene el objeto control e interface,0,actores
la activacion es inadecuada,-1,activacion
no estan numerados los mensajes la comunicacion sincronica es incorrecta,-1,mensajes
el diagrama no tiene nombre la secuencia de los procesos y la relacion entre ellos se cumple pero es un poco confuso al momento de entender como exactamente funcionaria el proceso,0,diagrama
a criterio personal considero que no deberia ir la entidad cita ya que dentro del historial deberian estar dichos datos por lo que el metodo consultarcita dentro de la entidad cita no tiene lugar en dicho diagrama,-1,criterio
la activacion de cada es objeto no es correcta en el lapso del tiempo,-1,activacion
no estan numerados los mensajes la comunicacion sincronica es incorrecta,-1,mensajes
no contiene nombre del diagrama,-1,nombre
los objetos se identifican correctamente,1,objetos
la activacion de los objetos esta de forma correcta,1,activacion
no contiene numeracion de los mensajes la comunicacion sincronica es correcta,0,numeracion
el diseno esta inadecuada,-1,diseno
se identifican correctamente los objetos pero falta el objeto diagnostico,0,objetos
las lineas de tiempo en algunas partes no son las correctas,-1,lineas
los mensajes en algunos casos no indican la funcionalidad correcta por ejemplo retorna diagnostico sale de entidad historial y va a control historial,-1,mensajes
no hay nombre del diagrama,-1,nombre
faltan objetos en el diagrama pero si se identifican bien los objetos,0,objetos
la activacion en ciertas partes no estan del todo correctas,-1,activacion
hay mensajes que no demuestran la funcionalidad que es,-1,mensajes
no posee nombre del diagrama la distribucion de los objetos mensajes y la activacion es ordenada,0,nombre
la entidad es inadecuada,-1,entidad
la activacion es inadecuada,-1,activacion
no posee numeracion de mensajes la funcionalidad no esta del todo correcta ya que entidad cita podria formar parte de la entidad historial,-1,numeracion
no tiene nombre el diagrama la distribucion de los mensajes y la activacion no es ordenada lo que hace que sea complicado de comprender,-1,nombre
el objeto entidad cita esta de mas,-1,objeto
la linea de tiempo no es la correcta ya que no llega al objeto ui registrar historial,-1,linea
los mensajes no tienen numeracion los mensajes no indican funcionalidad correcta de los requerimientos descritos,-1,mensajes
el diagrama no tiene nombre la activacion si esta ordenada pero faltan objetos y mensajes,0,diagrama
si se identifican correctamente los objetos pero faltan,0,objetos
en ocasiones no tiene concordancia algunas lineas de tiempo ya que la activacion de los objetos no es la correcta,-1,ocasiones
algunos mensajes no muestran funcionalidad y la numeracion no es ordenada,-1,mensajes
no hay el nombre del diagrama la distribucion de los objetos mensajes y la activacion no es ordenada,-1,nombre
existe un objeto cita que esta de mas,-1,objeto
la activacion de cada uno de los objetos no es correcta durante el lapso de tiempo que corresponde no existe algun mensaje de exito que se muestre en el ui para registrar historial,-1,activacion
la numeracion de los mensajes no existe la comunicacion es incorrecta los mensajes no indican funcionalidad correcta de los requerimientos descritos,-1,numeracion
no se encuentra el nombre del diagrama el orden de los objetos mensajes y activaciones es ordenada,0,nombre
no se encuentran la interfaz cita y el control cita para poder acceder a la entidad cita,-1,interfaz
algunos procesos son realizados dentro de la misma linea de tiempo haciendo que algunos procesos no logren su cometido completamente,-1,procesos
falta enumeracion de los mensajes,-1,falta
la distribucion de los objetos es adecuada y se encuentra ordenado,1,distribucion
no se identifican los controles de entidades involucradas en el diagrama,-1,controles
la activacion de los objetos se aplican correctamente en el lapso de tiempo adecuado,1,activacion
la numeracion no es correcta en uno de los mensajes los mensajes si indican funcionalidad de acuerdo a lo requerido,0,numeracion
nombre de diagrama incorrecto pero la distribucion de los elementos del diagrama es ordenada lo que lo hace facil de comprender,0,nombre
todos los objetos se los identifican de la manera correcta,1,objetos
la activacion de cada objeto es correcta en el lapso de tiempo que le corresponde,1,activacion
posee una enumeracion ordenada los mensajes de cualquier indole cumplen con su funcionamiento correcto y su funcionalidad esta correcta,1,enumeracion
la distribucion de los objetos en los diagramas son los correctos,1,distribucion
los objetos involucrados no se identifican correctamente,-1,objetos
la activacion es la correcta en el lapso del tiempo,1,activacion
la numeracion no es la correcta,-1,numeracion
no presenta un nombre el diagrama la distribucion de los objetos no estan bien definidos lo que afecta en el orden y ala comprension del mismo,-1,nombre
no se logra identificar todos los objetos requeridos para los elementos involucrados debido a que existe carencia de los mismos,-1,objetos
hasta cierto punto la activacion de cada uno de los objetos esta bien dentro de lo que cabe pero como existe una mal representacion de los objetos tanto la activacion en general como el lapso de tiempo no es correcta,0,punto
la numeracion de los mensajes se presenta de manera ordenada la comunicacion de igual manera esta plasmada de forma correcta tanto la asincrona como la sincronica los mensajes por su parte muestran la funcionalidad de forma aceptable con lo plasmado en el diagrama no obstante con los requerimientos descritos,1,numeracion
no hay nombre del diagrama no se puede saber a que caso de uso hace referencia este diagrama,-1,nombre
los objetos no estan bien definidos no se usan las figuras para cada uno de ellos por otro lado en la parte del control se han unido dos objetos para un solo control lo cual no esta bien ya que no se han usado las figuras correspondientes en el caso de las entidades no se ha especificado que sean entidades por lo que podria ser cualquier cosa y por ende no se identifican bien por ultimo se representan actores como objetos lo cual no es adecuado,-1,objetos
la activacion de los objetos no esta bien ejecutada se realizan activaciones que necesitan control sin pasar por este antes por otro lado la linea de tiempo hace referencia a objetos que no estan representados en el diagrama por lo que no siguen el lapso de tiempo que corresponde,-1,activacion
la numeracion de los mensajes esta ordenada segun se van ejecutando la comunicacion entre activaciones es correcta ya que aplica comunicacion sincronica de forma adecuada los mensajes son confusos a la hora de definir la funcionalidad que realizan y algunos no estan descritos en los requerimientos,0,numeracion
no existe un nombre de diagrama la distribucion de objetos no es la correcta,-1,nombre
los objetos no se identifican correctamente,-1,objetos
la activacion es inadecuada,-1,activacion
la numeracion de los mensajes es ordenada la comunicacion no es correcta los mensajes no indican la funcionalidad planteada,-1,numeracion
no se especifica el nombre del diagrama la distribucion de los objetos es correcta pero la activacion no esta ordenada no se puede comprender,0,nombre
no se puede identificar los objetos correctamente porque no se especifican mediante su respectivo icono,-1,objetos
la activacion no esta ordenada es dificil comprender el fin del proceso,-1,activacion
la numeracion de los mensajes no esta ordenada la comunicacion es medianamente correcta los mensajes indican funcionalidad correcta,0,numeracion
el nombre del diagrama es adecuado la distribucion de los objetos mensajes y activacion estan ordenadas,1,nombre
los objetos involucrados no estan identificados correctamente exceptuando el actor,-1,objetos
la activacion de cada objeto no es correcta en todos los casos,-1,activacion
los mensajes no tienen numeracion la comunicacion sincronica o asincronica es incorrecta en algunos casos los mensajes no indican la funcionalidad correcta de los requerimientos,-1,mensajes
el nombre del diagrama es adecuado faltan objetos que son necesarios para una mejor comprension del diagrama,0,nombre
faltan objetos importantes llama a procesos y a actores que no estan en el diagrama,-1,objetos
la activacion de los procesos no siempre es correcta algunos objetos retornan valores que no les corresponden,-1,activacion
los mensajes no poseen numeracion la comunicacion no siempre es correcta ya que hay procesos que necesitan retornar algo y no lo hacen,-1,mensajes
el nombre del diagrama es bastante adecuado al diagrama la distribucion de objetos es buena y permite entender facilmente el proceso realizado,1,nombre
los objetos involucrados no se identifican correctamente falta objetos de entidad,-1,objetos
la activacion de los objetos es incorrecta para poder mostrar un proceso se debe de validar a traves del control lo cual no hace al inicio,-1,activacion
no posee numeracion de mensajes la comunicacion sincronica y asincronica son incorrectas porque se necesita obtener los datos desde el objeto solo se muestran los mensajes en la interfaz no en la linea del actor,-1,numeracion
el nombre del diagrama es indicado la distribucion de los objetos es correcta,1,nombre
los objetos interfaz control e entidad no estan definidos de forma correcta,-1,objetos
la activacion en el lapso de tiempo de los objetos esta definida de forma correcta,1,activacion
no cuenta con la numeracion en los mensajes cuenta con comunicacion sincronica y asincronica los mensajes indican la funcionalidad de forma correcta,1,numeracion
el nombre del diagrama es adecuado pero tiene la distribucion de los objetos no es la correcta,0,nombre
todos los objetos involucrados se identifican correctamente,1,objetos
la activacion de cada uno de los objetos es correcta durante el lapso de tiempo que corresponde,1,activacion
no existe numeracion de los mensajes,-1,numeracion
el nombre del diagrama es adecuado la distribucion de los objetos es inadecuada lo que permite que sea complicado de comprender,0,nombre
todos los objetos involucrados se identifican correctamente,1,objetos
la activacion de cada uno de los objetos es correcta durante el lapso de tiempo que corresponde,1,activacion
no existe la numeracion de los mensajes la comunicacion sincronica correcta la mayoria de los mensajes indican funcionalidad correcta de los requerimientos descritos,0,numeracion
se especifica el proceso gracias al nombre del diagrama buena distribucion,1,proceso
se encuentran todos los objetos que intervendran dentro del proceso,1,objetos
todos los objetos tienen una activacion secuencial es decir se activa uno despues de otro,1,objetos
no se encuentra enumerado los mensajes buen uso de comunicacion sincronica y asincronica,0,mensajes
no tienen nombre el diagrama mala distribucion en los objetos,-1,nombre
faltan objetos importantes en el proceso,-1,objetos
la activacion de la linea de tiempo no es la adecuada,-1,activacion
no tienen numeracion los mensajes y existe una mala comunicacion,-1,mensajes
no tiene nombre de diagrama la distribucion de los objetos no es clara,-1,nombre
no se identifican todos los objetos correctamente,-1,objetos
la activacion no es correcta en el lapso de tiempo,-1,activacion
no tiene numeracion los mensajes los mensajes no tienen una funcionalidad correcta,-1,numeracion
el nombre del diagrama no es el adecuada pero la distribucion de los objetos y el control es facil de comprender,0,nombre
todos los objetos poseen la estructura correcta,1,objetos
la activacion de cada uno de los objetos es correcta durante el lapso de tiempo que corresponde,1,activacion
no posee una enumeracion de los mensajes pero la comunicacion y la funcionalidad son correctos,0,enumeracion
el diagrama no tiene nombre los objetos estan bien definidos facilitando la comprension del diagrama,0,diagrama
faltan objetos que son requeridos para una mejor funcionalidad del diagrama,-1,objetos
la activacion de los objetos no se encuentra del todo correcta se piden objetos que no se encuentran en el diagrama,-1,activacion
los mensajes no estan enumerados la comunicacion asincrona es incorrecta ya que no utilizaron la linea correcta,-1,mensajes
el nombre de la funcion no esta especificado la distribucion de los objetos y mensajes es correcta el diseno es legible,0,nombre
se involucran correctamente los actores los objetos y las interfaces,1,actores
las activaciones son claras y bien correspondientes a sus tareas,1,activaciones
las funcionalidades son correctas con los requerimientos los mensajes no estan enumerados,0,funcionalidades
no tiene nombre el diagrama la distribucion es correcta,0,nombre
los objetos se identifican correctamente,1,objetos
la activacion de los objetos es correcta,1,activacion
no hay numeracion de los mensajes la comunicacion es correcta los mensajes indican funcionalidad correcta,0,numeracion
el diseno esta inadecuada,-1,diseno
todos los objetos estan muy bien agregados y usan la ilustracion correcta,1,objetos
la linea de tiempo esta muy bien dividida,1,linea
la numeracion de los mensajes es ordenada la comunicacion sincronica es correcta los mensajes indican funcionalidad correcta de los requerimientos descritos,1,numeracion
no posee nombre de diagrama de secuencia la distribucion esta desordenada a partir de la entidad diagnostico,-1,nombre
existen entidades y controles demas,-1,entidades
posee un orden correcto de activacion trabajando por procesos separados cuando acaba otro,1,orden
no esta numerado ningun mensaje,-1,numerado
no se especifica el nombre del proceso en el diagrama la distribucion de los objetos mensajes y la activacion es ordenada ,0,nombre
todos los objetos involucrados se identifican correctamente,1,objetos
la activacion de cada uno de los objetos es correcta durante el lapso de tiempo que corresponde,1,activacion
no existe la numeracion en los mensajes la comunicacion sincronica es correcta los mensajes indican funcionalidad correcta de la mayoria de los requerimientos descritos,0,numeracion
el diseno esta inadecuada,-1,diseno
objetos detectados correctamente,1,objetos
la activacion de cada es objeto no es correcta en el lapso del tiempo,-1,activacion
no se muestran mensajes de salida al usuario,-1,mensajes
no se muestra el nombre del diagrama la distribucion de objetos y mensajes es ordenada,0,nombre
todos los objetos involucrados se identifican,1,objetos
cada objeto tiene una correcta activacion durante el tiempo correspondiente,1,objeto
no existe una enumeracion de los mensajes,-1,enumeracion
el nombre de diagrama es adecuado y facil de comprender la distribucion de sus componentes es correcta y funcional,1,nombre
ausencia de objetos importantes para el caso de estudio planteado,-1,ausencia
los objetos se activan de manera coherente y ordenada de manera que tiene sentido el flujo que este lleva,1,objetos
los mensajes no estan enumerados,-1,mensajes
el nombre del diagrama es correcto la distribucion de los objetos mensajes y activacion es ordenada,1,nombre
todos los objetos se identifican correctamente,1,objetos
la activacion y desactivacion de cada objeto es correcta,1,activacion
los mensajes contienen numeracion la comunicacion sincronica o asincronica es correcta los mensajes indican la funcionalidad correcta de los requerimientos,1,mensajes
el diagrama de secuencia era uno solo registrar diagnostico y asignar tratamiento nunca se especifico hacerlo por partes lo cual no existe un funcionamiento correcto del diagrama,-1,diagrama
todos los objetos se encuentran muy bien especificados solo que existe muy poca iteracion entre los objetos,1,objetos
la linea de tiempo entre cada uno de los objetos es la correcta ya que cumple con lo que se requiere,1,linea
los mensajes indican una funcionalidad correcta de los requerimientos descritos la numeracion de los mensajes es correcta existe una comunicacion sincronica y asincronica,1,mensajes
el nombre del diagrama esta bien aunque han hecho  diagramas,1,nombre
si esta involucrado el actor la interfaz el control y la entidad,1,actor
las lineas de tiempo en algunos casos no estan bien,-1,lineas
no se entienden las funcionalidades y la comunicacion sincronica y asincronica estan un poco bien,-1,funcionalidades
todos los puntos que se tiene dentro de este apartado esta correcto es decir esta tanto el nombre del diagrama como los objetos,1,puntos
esta usando correctamente el actor el control la entidad y el sistema,1,actor
esta usando correctamente la linea de tiempo entre cada caso,1,linea
las comunicaciones sincronicas y asincronicas estan bien pero no hay un regreso a la primera entidad para mostrar un mensaje final que llega al usuario que lo invoco,0,comunicaciones
el nombre del diagrama es adecuado su distribucion de objetos y mensajes es la adecuada,1,nombre
todos los objetos involucrados se muestran correctamente,1,objetos
la activacion de cada es objeto no es correcta en el lapso del tiempo,-1,activacion
no cuenta con la numeracion su comunicacion sincronica es correcta los mensajes indican la funcionalidad correcta,0,numeracion
el nombre del diagrama es correcto y tambien se encuentran correctamente distribuidos los objetos,1,nombre
presenta correctamente los tres objetos que son interfaz control y entidad,1,objetos
la activacion durante el lapso de tiempo que usa cada objeto son correctos,1,activacion
la comunicacion no es la correcta deberia regresar en la primera parte a la entidad,-1,comunicacion
no contiene nombre del diagrama la distribucion de los objetos esta en desorden lo que hace que sea bastante dificil de leer,-1,nombre
no existe una interfaz de cita y los objetos existentes no estan bien identificados,-1,interfaz
la activacion de cada una de las lineas de tiempo es correcta se activan cuando se empiezan a utilizar y se desactivan cuando deja de utilizarse,1,activacion
la numeracion de los mensajes es correcta la comunicacion sincronica o asincronica es correcta los mensajes indican la correcta funcionalidad de los requerimientos,1,numeracion
no contiene nombre del diagrama,-1,nombre
los objetos se identifican correctamente,1,objetos
existe un corte en el lapso de tiempo que no deberia cortarse,-1,corte
la numeracion de los mensajes es correcta la comunicacion sincronica es correcta,1,numeracion
no contiene nombre el diagrama objetos desordenados y dificil de entender,-1,nombre
estan los objetos pero desordenados,0,objetos
la activacion durante el lapso de tiempo que usa cada objeto son correctos,1,activacion
no estan numerados los mensajes la comunicacion sincronica es incorrecta,-1,mensajes
el diseno esta inadecuada,-1,diseno
objetos detectados correctamente,1,objetos
linea de tiempo erronea,-1,linea
no estan numerados los mensajes la comunicacion sincronica es incorrecta,-1,mensajes
no cuenta con el nombre del diagrama su distribucion no es correcta ya que no tiene la secuencia debida,-1,nombre
todos los objetos se involucran de forma correcta,1,objetos
todas las activaciones se realizan cuando es debido,1,activaciones
la numeracion de los mensajes se encuentra ordenada cuenta con una comunicacion sincronica de forma correcta,1,numeracion
no tiene nombre el diagrama de secuencia,-1,nombre
los objetos involucrados no se identifican correctamente falta objetos de entidad,-1,objetos
la activacion durante el lapso de tiempo que usa cada objeto son correctos,1,activacion
no existe numeracion en los mensajes las comunicaciones se realizan de manera correcta los mensajes si muestran funcionalidad correcta pero no de todos los requerimientos solicitados,0,numeracion
el nombre del diagrama es el adecuado,1,nombre
todos los objetos se identifican correctamente,1,objetos
la activacion de los objetos es correcta,1,activacion
la enumeracion de los mensajes es ordenada,1,enumeracion
efectivamente el nombre del diagrama es el adecuado otorgado por la docente la organizacion de los objetos son precisos sus mensajes y la activacion es apropiada de acuerdo a los requerimientos establecidos del ejercicio,1,nombre
se representan todos los objetos adecuadamente con su actor interfaz control entidad la cual estan involucrados y se identifican apropiadamente aunque pienso que debio jugar el actor paciente para que sea mas entendible el diagrama,0,objetos
de acuerdo con su activacion de los objetos en el lapso de tiempo realmente no se si encuentre bien como separo el diagramaalternativa con existen pacientes en vez de hacerlo corrido y no perder la linea del tiempo  esto hace que no sea entendible,-1,acuerdo
asi mismo con la numeracion de los mensajes se encuentra confuso como se perdio la linea de tiempo no se sigue su orden referente a la comunicacion es adecuada si se encuentra logica los mensajes si indican aceptables de acuerdo a los requerimientos del ejercicio o en otro caso si existiera la plantilla donde se verifica sus flujo normal como alterno,0,numeracion
el nombre del diagrama es el correcto ademas consta de los objetos mensajes y la activacion es ordenada lo que cual facilita que sea claro de comprender,1,nombre
los objetos que se denotan en el diagrama de secuencia se identifican correctamente tales como son el actor interfaz control y entidad cumplen con lo que se requiere,1,objetos
el diagrama de secuencia cuenta con cada uno de los objetos lo cual quiere decir que durante el lapso de tiempo cumple con lo que corresponde,1,diagrama
la numeracion de los mensajes es ordenada ya que existe una comunicacion correcta entre los mensajes lo cual indican funcionalidad correcta de los requerimientos descritos,1,numeracion
el nombre del diagrama es el adecuado la distribucion de los objetos es ordenada por lo que es facil de entender,1,nombre
faltan objetos necesarios para una mejor funcionalidad,-1,objetos
la activacion d los objetos no es del todo correcta ya que hace referencia a otros objetos que no se encuentran en el diagrama,-1,activacion
los mensajes estan enumerados y ordenados la comunicacion no siempre es correcta,0,mensajes
no presenta nombre del proceso la distribucion de los objetos que se presentan no siguen una secuencia logica debido a que hacen falta otros objetos,-1,nombre
los objetos involucrados no se identifican correctamente debido a que no estan todos los objetos necesarios,-1,objetos
basados en los objetos que presentaron muestran la idea logica de como se activaria cada proceso sin embargo al no tener todos los objetos las activaciones no se dan donde deberian darse,-1,objetos
la numeracion esta ordenada los mensajes presentan la funcionalidad correcta pero hay mensajes que no terminan donde deberian,0,numeracion
el diseno esta inadecuada,-1,diseno
objetos detectados correctamente,1,objetos
