Comentario,Polaridad,Aspecto
los nombres de las clases estan descritos con mayusculas falta una clase faltan metodos,-1,nombres
faltan los atributos de la clase faltante en el diagrama de casos de uso,-1,atributos
faltan los metodos de la clase faltante en el diagrama de casos de uso faltan metodos de las clases que constan en el diagrama no indica el tipo de datos de los metodos,-1,metodos
faltan las asociaciones de la clase no descrita en el diagrama se consta de errores en la relacion de la clase contrato y reserva,-1,asociaciones
el diagrama de clase consta con los nombres adecuados pero sin embargo todos estan en mayuscula y le faltan unos metodos a ciertas clases,0,diagrama
el diagrama posee los nombres adecuados de los atributos con su respectivo tipo de dato,1,diagrama
el diagrama consta con el tipo de dato visibilidad  sin embargo faltan agregar mas metodos aciertas clases,0,diagrama
el diagrama posee correctamente las cardinalidades y las flechas estan correctas,1,diagrama
posee una estructura correcta globalmente no se detectan todas las clases hacen falta algunas clases de importancia y existen algunos metodos incoherentes,0,estructura
posee los atributos necesarios para cada clase pero al no estar completo no se encuentra la funcionalidad,0,atributos
pose los metodos necesarios para cada clase pero al no estar completo no se encuentra la funcionalidad,0,metodos
las cardinalidades se denotan correctamente pero al haber clases faltantes las relacion cambia totalmente por lo cual el diagrama tiene fallas notables y la direccion de navegacion cambia drasticamente,0,cardinalidades
los nombres de las clases son adecuados pero estan complemente en mayuscula,0,nombres
los atributos cubren las propiedades principales mas no todas asi mismo solo los atributos tiene tipo de datos asi mismo los datos de retorno no se pueden apreciar y no contienen tipo de dato la visibilidad si se puede apreciar superficialmente,-1,atributos
los metodos desarrollados son apenas suficientes para representar las funcionalidades pertinentes los nombres de los metodos no contienen verbo en casi todos los casos los metodos no contienen argumentos con sus respectivos tipos de datos los metodos no contienen tipo de dato de retorno,-1,metodos
la comunicacion se pudo haber mejorado mucho la relacion entre las clases reserva y contrato esta incorrecta y parece improvisada la cardinalidad de obligatoriedad es bastante discutible y ambigua la cardinalidad de relacion tiene solo errores puntuales como en la relacion entre las clases reserva y contrato,-1,comunicacion
el diagrama consta con los nombres de las clases correctos y todos estan en mayusculas esto ayuda el entendimiento del diagrama,1,diagrama
los atributos se expresan con claridad y poseen un nombre adecuado para cada clase posee el tipo de dato y su visualidad,1,atributos
los metodos estan correctos pues estan formados de verbos todos los metodos poseen su tipo de dato sin embargo faltan anadir ciertos metodos a algunas clases,0,metodos
todas las clases poseen las direcciones de navegacion entre todas las asociaciones las cardinalidades estan correctas los roles mostrados son los necesarios par el correcto funcionamiento del sistema,1,clases
no todos los nombres de la clases cumplen con los requisitos ya que algunos no son sustantivos sino que verbos pero si indica la estructura adecuada de los atributos y metodos,0,nombres
los nombres de los atributos expresan una propiedad de la clase y se indican adecuadamente todo los puntos que lo definen,1,nombres
los nombres de los metodos estan bien definidos pero no indica el tipo de dato pero si indica la visibilidad adecuada,0,nombres
todas las cardinalidades roles y direccion de navegacion se denotan adecuadamente,1,cardinalidades
el nombre de las clases estan mal porque se encuentran con letras mayusculas no se encuentran todas las clases de este caso practico la estructura de cada uno de las clases estan mal definidas existen clases nuevas que no pertenecen al caso practico,-1,nombre
los estructura de los nombre de los atributos estan definidos correctamente el argumento de cada uno estan un poco confuso al momento de tratar de seguir el flujo no se detecto todos los atributos con sus tipo de datos que corresponde a cada clase,0,estructura
la estructura de los metodos estan definida correctamente existen metodos que no se encuentran definidos para realizar el caso practico,-1,estructura
la cardinalidad de cada clase esta mal definida los roles de cada una de las clases no existen no existen asociaciones al momento de entrelazar una clase con otra,-1,cardinalidad
los nombres de las clase estan correctamente planteadas  se detectan que el numero de clases son las idoneas,1,nombres
el nombre de los atributos planteados en el diagrama son correctos asi como el tipo de datos y su visibilidad,1,nombre
los nombres de los metodos son correctos cuentan con sus respectivos tipos de datos y tipo de valor de retorno y cada metodo representan funcionalidades del sistema,1,nombres
la cardinalidades estan correctas y existe una correcta comunicacion entre clases,1,cardinalidades
los nombres de las clases son adecuados y cumplen con el formato requerido todas las clases poseen una estructura adecuada los atributos y metodos especificados son importantes y necesarios la informacion es detallada y coherente,1,nombres
los nombres de los atributos son adecuados expresan claramente una propiedad propia de la clase los tipos de datos especificados son adecuados y poseen una visibilidad adecuada,1,nombres
los nombres de los metodos son adecuados expresan claramente una accion u operacion de la propia clase faltan metodos para algunas clases los argumentos tipo de datos y tipos de valor de retorno son visibles y adecuados,1,nombres
las cardinalidades se pueden apreciar en su totalidad algunas cardinalidades no son adecuadas la direccion de navegacion de las asociaciones se especifica de forma poco correcta los tipos de asociaciones no son empleados correctamente,-1,cardinalidades
los nombres de todas las clases son adecuados pues cumplen con la regla de ser sustantivos y empezar con mayusculas faltaria una superclase llamada vehiculo se encuentran los metodos y atributos mas importantes en cada clase del diagrama,1,nombres
los atributos cumplen con norma de ser sustantivos ademas de especificar funcionalidades directas de la clases los tipos de datos se encuentran detallados a un lado del atributo las clases cuentan con la mayoria de atributos requeridos,1,atributos
los metodos son verbos por lo que si definen una accion no se indican parametros en ninguna funcion o metodo los metodos indican la mayoria de las funciones requeridas,1,metodos
las cardinalidades descritas coinciden en casi todas las relaciones de los clases no existen roles en ningun lugar del diagrama la direcciones de navegacion de las asociaciones son en su mayoria correctas,0,cardinalidades
el diagrama consta de una correcta estructura y orden de las clases cada una posee sus atributos y metodos importantes los nombres estan en mayuscula las clases esta desarrolladas de un manera correcta,1,diagrama
el diagrama posee los nombres claros debido que con el nombre ya se sabe a que se esta refiriendo posee sus argumentos tipo de dato y visibilidad,1,diagrama
los metodos del diagrama esta correctos debido a que constan de verbos acompanada del nombre de la clases esto permite identificarlos rapidamente para saber a que clase pertenece ese metodo,1,metodos
las direcciones de navegacion no estan correctas debido a que algunas flechas estan en sentido contrario,-1,direcciones
las clases son correctas y sus nombres tambien pero hacen falta clases respecto a la informacion proporcionada en los casos de uso,0,clases
los atributos de las clases son redundantes y algunos de ellos hacen falta atributos importantes tambien se puede observar que el tipo de dato asignado en alguno de ellos no es el adecuado,-1,atributos
los metodos no tienen argumentos y todos en algunas clases no existen ningun tipo de metodos tampoco se puede observar que los metodos cuenten con los atributos necesarios,-1,metodos
la generalizacion fue aplicada correctamente las distintas clases tienen cardinalidades no correspondientes lo que generaria anomalias,0,generalizacion
los nombres de las clases son adecuados son sustantivos y empiezan con mayusculas globalmente se detectan todas las clases medianamente correctas para cada clase se indica la estructura adecuada atributos y metodos la informacion reportada es detallada y algo coherente,1,nombres
los nombres de los atributos son adecuados son sustantivos etc expresan claramente una propiedad de la clases se indica el tipo de datos y la visibilidad adecuada se han detectado todos los atributos correctamente,1,nombres
los nombres de los metodos son adecuados son verbos y expresan con claridad la accion y operacion de la clase no tienen argumentos tienen el tipo de dato valor de retorno y visibilidad adecuada los metodos indican funcionalidad medianamente correcta de los requerimientos descritos,1,nombres
todas las cardinalidades se denotan correctamente todos los roles se especifican medianamente adecuados la direccion de navegacion de todas las asociaciones se especifican medianamente correctas,1,cardinalidades
las clases tiene los nombres como las especificaciones piden tienen una buena estructura,1,clases
son sustantivos son especificos pero hay algunos tipos de datos que no deberian de ir en la clase que lo han puesto,0,tipos
los metodos estan incorrectamente,-1,metodos
hay cardinalidades que no estan bien puestas o que no debieran de efectuarse asi,-1,cardinalidades
las clases estan correctas,1,clases
no tiene tipo de datos y aparte todos los atributos son publicos,-1,tipo
los metodos no tiene el tipo de retorno,-1,metodos
no tiene cardinalidades,-1,cardinalidades
las clases si inician con mayusculas tambien la generalizacion que se realiza de persona con demas involucrados es correcta y la estructura es correcta es decir que cada clase cumple con tener sus atributos y metodos importantes,1,clases
los atributos son los correctos cada clase cuenta con los atributos que necesita tener,1,atributos
los metodos que tienen cada una de las clases sobre todo los principales pero a causa de que faltan algunos casos de uso no es posible tener los metodos de por ejemplo de registrarpaciente,-1,metodos
no se si es por la herramienta que estan usando pero yo no encuentro las asociaciones entre las clases quizas las flechas signifiquen algo pero personalmente no conozco,-1,herramienta
los nombres de las clases son los adecuados la estructura no es adecuada,0,nombres
no posee los tipos de datos en los atributos,-1,tipos
los metodos no contienen un tipo de valor de retorno,-1,metodos
no contiene cardinalidades la direccion de la navegacion es confusa,-1,cardinalidades
en el diagrama de clases hay nombres de clases demas la estructura esta correcta mas no la informacion,0,diagrama
algunos sustantivos no son lo adecuados y ningun atributo tiene su respectivo tipo de dato,-1,sustantivos
no todos los metodos empiezan con un verbo como por ejemplo personalnomedico paciente entre otros por lo tanto no son los adecuados ya que tienen el mismo nombre de la clase y esa no es una funcionalidad,-1,metodos
las asociaciones no son las correctas y no tienen cardinalidades,-1,asociaciones
no se entiende la informacion colocada en el diagrama y esta muy confuso el nombre de las clases esta bien y los metodos igual,-1,informacion
los nombres de los atributos estan bien pero la visibilidad esta mal esta publica cuando deberia ser privada y tampoco se ve el tipo de dato que es cada atributo,0,nombres
el nombre de los metodos no son verbos no se muestra el tipo de dato que retorna si se aprecia la visibilidad y en lo que va en la funcionalidad la mayoria tiene metodos del nombre de la clase que no hace referencia a nada,-1,nombre
no hay ninguna cardinalidad y la asociacion tampoco estan del todo correctas,-1,cardinalidad
algunos nombres de clases son palabras compuestas y no sustantivos propios,-1,nombres
el nombre de algunos atributos son palabras compuestas y no solo un sustantivo o adjetivo no muestra el tipo de dato que cada atributo maneja,-1,nombre
el nombre de algunos metodos son verbos compuestos en la clase persona hay un metodo que se llama persona y no indica nada asi como con la mayoria de las clases sucede lo mismo no se indica el tipo de dato ni el valor de retorno no indican una funcionalidad adecuada,-1,nombre
no tiene cardinalidades en ninguna clase los roles se confunden unos de otros la direccion de navegacion no es la correcta,-1,cardinalidades
existe clases que no son necesarias por ejemplo operacion no medica o operacion medica,-1,clases
el tipo de visibilidad no es la correcta ya que se estan dejando todos los atributos de forma publica tampoco se indica el tipo de datos va a contener ese atributo,-1,tipo
los metodos no especifica el tipo de valor de retorno la funcionalidad no es la correcta de los requerimientos descritos,-1,metodos
no tiene ninguna cardinalidad en todo el diagrama existen asociaciones que no son necesarias,-1,cardinalidad
los nombres de las clases estan incorrectos ya que no son los mismos que se encuentran en el diagrama de casos de uso y la informacion no se encuentra clara ni coherente lo unico que se puede rescatar es que la estructura esta correcta,-1,nombres
no tiene definido el tipo de dato algunos sustantivos no son los adecuados y no se encuentran todos los atributos completos,-1,tipo
los nombre de los metodos no son los adecuados ya que casi todos tienen el mismo metodo del nombre de la clase y esa no es ninguna funcionalidad tampoco tiene el tipo de dato ni el valor de retorno,-1,nombre
no tienen cardinalidades y las pocas asociaciones que tienen estan incorrectas,-1,cardinalidades
no todos los nombres de las clases son adecuados,-1,nombres
los nombres de los atributos son adecuados y expresan claramente una propiedad de la clase,1,nombres
no todos los nombres de los metodos son adecuados algunos no son verbos y no expresan claramente una accion u operacion de la clase,-1,nombres
no existe cardinalidad entre clases,-1,cardinalidad
existen clases de mas que pueden ser generalizadas en una sola,-1,clases
algunos atributos no se encuentran con su clase correspondiente,-1,atributos
muchas metodos que se ven que devuelven un o unos datos no tienen retorno,-1,metodos
no existe cardinalidad dentro del diagrama se puede llegar a confundir al visualizar los roles,-1,cardinalidad
no se detectan todas las clases correctamente en el diagrama,-1,clases
los nombres de los atributos son adecuados a lo requerido,1,nombres
no se indica correctamente el argumentos de los metodos aplicado en las clases,-1,argumentos
no se encuentra cardinalidad en la asociacion entre clases,-1,cardinalidad
los nombres de las clases son adecuados la informacion y la estructura es detallada y coherentes pero faltan mas clases,0,nombres
la estructura de los atributos tanto como su visibilidad y su tipo de datos son expresados de manera correcta pero hay ciertos datos que no pertenecen a un tipo de atributo especifico,0,estructura
la estructura de los metodos su visibilidad y el tipo de dato estan correctamente estructuradas aunque hay ciertas falencias en algunas devoluciones de datos en unos pocos metodos,0,estructura
faltan cardinalidades los roles aunque se denotan no se especifican detalladamente y la direccion de navegacion se denota de forma medianamente correcta,-1,cardinalidades
tiene errores en las clases,-1,errores
los atributos se han detectado correctamente,1,atributos
no existen argumentos en los metodos,-1,argumentos
no tiene cardinalidad entre entidades,-1,cardinalidad
los nombres de las clases estan bien escritos permitiendo que se detecten a nivel global con respecto a su estructura los atributos y metodos en su mayoria son correctos pero hay algunos que no estarian bien representados lo que ocasiona que no toda la informacion sea coherente sin embargo si esta detallada,0,nombres
los nombres de los atributos son adecuados y corresponden a una propiedad de la clase el tipo de dato se indica de manera correcta con respecto a la visibilidad solo pocos atributos no estan del todo bien definidos los atributos colocados con excepcion de unos pocos son los adecuados,1,nombres
los nombres de los metodos son los correctos en este caso no se indican los argumentos ni el tipo de dato ni el valor de retorno pero si la visibilidad los metodos indican funcionalidad pero ciertos metodos no corresponden a la clase en la que se encuentran,0,nombres
no se presentan cardinalidades en el diagrama existen roles que no estan especificados de forma correcta con respecto a la direccion de navegacion se presentan ausencia de asociaciones necesarias,-1,cardinalidades
los nombres de las clases son adecuados son sustantivos y estan en mayuscula todos las clases se encuentran de forma rapida pero son insuficiente las clases cada clase tiene adjunto sus metodos y atributos adecuados dentro de su estructura la informacion que se reporta es insuficiente y tiene falta de componentes para una correcta representacion,0,nombres
los nombres que se emplean para identificar los atributos son adecuados y expresan la propiedad intrinseca de cada clase en la mayoria de los casos pero en algunas clases sobran atributos pues hay aplicada herencia en la mayoria de las clases y por lo tanto estas clases ya adquieren dichos atributos en otros casos los atributos no estan especificados cada atributo tiene un tipo de dato asignado y una visibilidad que es correcta falta algun atributo que defina el tipo de especialista que va a realizar la intervencion al paciente,0,nombres
los nombres de los metodos adecuados son verbos y expresan la accion que debe realizar cada clase estos metodos carecen de argumentos aquellos que deberian recibir algun parametro el tipo de valor de retorno esta bien especificado y su visibilidad es adecuada y correcta algunos de los metodos planteados indican la funcionalidad correcta de los requerimientos descritos ya que falta un metodo para emitir el diagnostico,0,nombres
no hay expresada ninguna cardinalidad ya que al parecer todos las clases constan de alguna herencia o dependencia los roles no estan especificados adecuadamente ya que un especialista no realiza pruebas son metodos inherentes a esa clase y no se deberian heredar la direccion de la navegacion esta bien pero no es la que se especifica en los requerimientos,-1,cardinalidad
los nombres de las clases son adecuados la estructura es adecuada la informacion detallada no es coherente,0,nombres
los nombres de los atributos son adecuados se indica visibilidad y tipo de datos adecuadamente,1,nombres
los metodos son incorrectos no indica los parametros para cada metodo la visibilidad no es la apropiada y la funcionalidad no es correcta de acuerdo a lo descrito,-1,metodos
no existen cardinalidades y tampoco direcciones de navegacion,-1,cardinalidades
los nombres de las clases son adecuados aunque hace falta mas clases que representen a los objetos cada clase tiene sus atributos y metodos con la estructura adecuada la informacion es detallada pero poco coherente,0,nombres
los nombres de los atributos son adecuados aunque varios estan demas los tipos de datos de pocos atributos se encuentran mal definidos,0,nombres
existen metodos dentro de clases que no corresponden a la misma si tienen tipo de valor de retorno aunque no es el correcto pero presentan visibilidad adecuada no presentan una correcta funcionalidad,-1,clases
las clases no se encuentran bien asociada ya que la direccion de la navegacion no es la correcta no usan los roles de manera adecuada no hay ningun tipo de cardinalidad,-1,clases
los nombres de las clases son adecuados se detectan todas las clases segun los casos de uso las clases tienen su adecuada estructura,1,nombres
los nombres de los atributos expresan una propiedad de la clase se indica el tipo de dato y la visibilidad adecuada para cada atributo,1,nombres
los nombres de los metodos expresan la accion que cumplen en la clase ninguno necesita argumentos se indica el tipo de valor de retorno y la visibilidad los metodos indican la funcionalidad descrita en el diagrama de casos de uso,1,nombres
las cardinalidades se denotan de forma incorrecta ya que estan al reves no utiliza roles la direccion de navegacion es incorrecta ya que todas las lineas tienen flechas,-1,cardinalidades
los nombres de las clases estan correctos no se detectan todas las clases necesarias cada clase posee una estructura adecuada,0,nombres
los nombres de los atributos son adecuados el tipo de datos en algunos atributos es incorrecto faltan atributos,0,nombres
los nombres de los metodos son adecuados no poseen valor de retorno faltan metodos,0,nombres
las cardinalidad esta incorrecta entre la mayoria de las clases muy mala direccion de navegacion ,-1,cardinalidad
no se detectan las clases de los medicos y los administrativos indicando que los pacientes pueden realizar todo el proceso dentro del hospital,-1,clases
todo esta correcto dentro de las clases indicadas,1,clases
los nombres no son correctos ya que se confunden facilmente con los metodos de otras clases al llamarlos si indican la funcionalidad de la clase pero se debe detallar a cual pertenecen para que no exista redundancia al llamar las clases,0,nombres
una cardinalidad es erronea ya que un paciente puede tener mas de un diagnostico y no solo uno la direccion de navegacion es incorrecta ya que no debe llevar flechas a menos que sea generalizacion,-1,cardinalidad
los nombres de las clases son adecuados cuenta con loa atributos y metodos importantes la informacion se muestra de forma correcta,1,nombres
cuenta con los nombre de los atributos correctos los atributos son privados,1,nombre
los nombres de los metodos son correctos su visibilidad es publica lo cual es correcta para el uso de otras clases en algunos metodos falta poner argumentos,1,nombres
las cardinalidades se encuentran al reves las flechas de direccion no son correctas ya que todas cuentan con una linea,-1,cardinalidades
globalmente no se encuentran todas las clases ademas hay clases que no deberian ir por ejemplos procedimiento operacion la informacion no es coherente,-1,clases
en clase paciente no deberia ir el atributo numero_colegiado ya que ese atributo le pertenece a la clase medico clase que no existe en el grafico,-1,clase
los nombres de los metodos son los adecuados y expresan claramente una accion en la clase,1,nombres
segun la direccion de las flechas me indican que todo el grafico tiene herencias lo cual esta mal se utiliza  formas de poner cardinalidades  y n deberia usar solo una para no confundir y ademas tiene mal las cardinalidades entre clases por ejemplo con las cardinalidades puestas entre la clase paciente y operacion se aluce que un tipo de operacion solo sera posible a un paciente,-1,direccion
los nombres de las clases son adecuados no se detectan correctamente todas las clases globalmente informacion detallada pero no coherente,0,nombres
los nombres de los atributos son adecuados se indica el tipo de dato y la visibilidad adecuada se detectan casi todos los atributos correctamente numero_colegiado no pertenece a la clase que lo tiene,1,nombres
los nombres de los metodos son adecuados,1,nombres
se usan dos diferentes maneras de representacion en las cardinalidades y no todas estan plasmadas de manera correcta,-1,maneras
las clases tienen un nombre adecuado para representarse,1,clases
los nombres de los atributos son representativos cada atributo demuestra su tipo de dato con una visibilidad adecuada,1,nombres
existen metodos que necesitan argumentos sin estos,0,metodos
se muestra correctamente las cardinales los roles son especificados correctamente,1,roles
faltan varias clases importantes para el caso de estudio,-1,clases
faltan atributos y el tipo d dato en algunos caso no es el correcto,-1,atributos
ningun metodo consta con los parametros que va a recibir no existe metodo de actualizar,-1,ningun
las relaciones estan todas al reves,-1,relaciones
no se detectan todas las clases adecuadamente no toda la informacion es coherente,-1,clases
no se indica el tipo de dato de los atributos asignados a cada clase,-1,tipo
los nombres de los metodos son poco adecuados no se indica el argumento ni el tipo de valor de retorno los metodos no funcionan correctamente,-1,nombres
no todos los roles se especifican correctamente,-1,roles
los nombres de las clases son adecuados su estructura esta correcta pero la informacion reportada no es coherente,0,nombres
los atributos cumplen con su respectiva estructura pero no presentan visibilidad y no cumplen con la funcionalidad adecuada,-1,atributos
los nombres de los metodos son correctos y posee una visibilidad adecuada pero la estructura no es la correcta y no se detectaron todos los atributos,0,nombres
las cardinalidades se denotan de forma correcta pero los roles y los datos de navegacion no estan correctamente estructurados,0,cardinalidades
los nombres de las clases son los adecuados se encuentran todas las clases necesarias,1,nombres
los atributos no poseen el tipo de dato,-1,atributos
los metodos no poseen tipo de datos ni tipo de valor de retorno faltan metodos para que se cumpla la funcionalidad correcta de los requerimientos,-1,metodos
la direccion de navegacion no es correcta en todas las asociaciones,-1,direccion
todas las clases involucradas en el sistema no se detectan correctamente,-1,clases
parte de los nombres son especificados y detectados correctamente el tipo de dato no se ha establecido,0,parte
