Comentario,Polaridad,Aspecto
la caratula sin errores ortograficos,1,caratula
la estructura del documento se visualiza correctamente tambien cuenta con la mayoria de los elementos solicitados pero no cuenta con herencias y en ciertos casos de uso no se realizaron con la sintaxis correcta,0,estructura
no existen herencias la relacion entre los casos de uso no estan correctamente disenados no existe un orden y contiene errores de comunicacion existen casos de uso la aislados y la aplicacion de los include no es la correcta en los casos de uso como cancelar reserva y validar usuario donde ademas de no haber ninguna relacion este incluye mas casos de uso como consultar reserva no existe concordancia,-1,herencias
al existir tantos errores en el procedimientos es notorio que son pocos los casos de uso con un buen funcionamiento,-1,errores
la caratula sin errores ortograficos,1,caratula
estructura no contiene codigo prioridad,-1,estructura
en el procedimiento aplica correctamente los include extends y herencia,1,procedimiento
en el funcionamiento le falta un include a la hora de registrar un contrato de furgoneta para verficar si hay disponibilidad de furgoneta,-1,funcionamiento
la caratula sin errores ortograficos,1,caratula
la sintaxis de los casos de uso es correcta sin embargo dentro de la estructura los casos de usos no cuentan con el codigo de prioridad,0,sintaxis
el caso de uso cancelar reserva tiene un include con el caso de uso validar usuario sin embrago no existe una secuencia logica ya que no existe conexion con el caso de uso registrar cliente,-1,caso
en los casos de uso no existe el requerimiento de las altas y bajas de los vehiculos por lo tanto no existen vehiculos registrados en los casos de usos registrar contrato de furgoneta y automovil no existe una secuencia logica ya que no consulta si existe o no una reserva de dicho vehiculo al cual se quiere generar el contrato,-1,casos
la caratula sin errores ortograficos,1,caratula
no esta facil de entender ya que hay casos de uso que no estan bien definidos y por ultimo tiene casos de uso que no tienen relacion en este caso son islas,-1,facil
no se ha utilizado el extends ni herencia en el caso de estudio y no tiene la logica requerida para la respectiva factibilidad,-1,extends
no cumple con todos los requerimientos solicitados ni con las funcionalidades,-1,requerimientos
excelente presentacion de la caratula contiene todos los elementos requeridos,1,presentacion
falto ubicar el codigo de orden a cada caso de uso,-1,codigo
algunos casos de uso no presenta una correcta secuencia logica por ejemplo el caso de uso consultar reserva y validar reserva no presenta logica alguna,-1,casos
el diagrama de caso de uso no presenta una correcta funcionabilidad debido a la falta de correctas interacciones,-1,diagrama
si posee todos los parametros indicados en la caratula y no posee errores ortograficos,1,parametros
la estructura no esta ordenada dificultando el entendimiento del diagrama la sintaxis utilizada no es la correcta algunos casos de uso no presentan el verbo en infinitivo mas el objeto los casos de uso no presentan codigo y existen islas,-1,estructura
la solucion presentada tiene pocos procesos con secuencia logica no hay una correcta aplicacion de include y extend,-1,solucion
la solucion no posee una correcta funcionalidad con algunos de los requerimientos del caso de estudio ademas los casos de uso no demuestran una interaccion con el objeto,-1,solucion
la caratula contiene errores ortograficos,-1,caratula
el documento en la sintaxis no contiene el codigo para cada caso de uso respectivo,-1,documento
el documento contiene de manera correcta los procesos,1,documento
la solucion solo cumple en algunos requerimientos especialmente en los requerimientos del empleado al tomar como empleado como sistema,0,solucion
la estructura de la caratula y su contenido son correctos y en la descripcion del problema no se han encontrado faltas ortograficas,1,estructura
los casos de uso estan separados en  islas el sentido de las flechas tanto del include como del extend depende de la funcionalidad pero existen no hay codigo de casos de uso el sistema no es un usuario por lo tanto la estructura se visualiza con dificultad debido a que contiene algunos elementos la sintaxis no es correcta y no esta ordenada,-1,casos
usa de forma incorrecta tanto include como extend no existe ninguna herencia entre actores y la herencia de casos de usos existente no tienen ninguna secuencia logica no hay una correcta asociacion entre actores y casos de uso por lo tanto no hay procesos correctos y hay una nula secuencia logica en el documento,-1,forma
los casos de uso no incluyen todos los requerimientos del caso de estudio si bien estan escritos algunos de los requerimiento no funcionan de manera correcta debido a la mala asociacion de los mismos con los demas casos de uso la interaccion con el objeto de cada caso de uso es incorrecta debido a la utilizacion de multiples objetos dentro de una misma funcionalidad no hay registro de automoviles no hay una correcta validacion de usuario y permite que tanto empleado como cliente creen un nuevo usuario y este caso de uso no lleva a ningun lado por lo tanto la solucion propuesta tiene funcionalidades incorrectas de todos los requerimientos descritos,-1,casos
la caratula cumple con todos los parametros requeridos para la presentacion del trabajo y el documento cuenta con el enunciado de los requerimientos que describe la ejecucion del trabajo no existen errores ortograficos,1,caratula
no existe codigo para cada caso de uso existen varias islas la definicion del nombre de los casos de uso es correcta pero no hay orden,0,codigo
herencia no esta aplicada correctamente la aplicacion de includes y extends es inentendible no existe una logica en la asociacion entre casos de uso,-1,herencia
no se incluyen algunos requerimientos del caso de estudio ni se implementan algunas funcionalidades,-1,requerimientos
la caratula sin errores ortograficos,1,caratula
la comunicacion entre algunos casos de uso es incorrecta los casos de uso no contiene codigo por tanto no esta ordenada y existen casos de usos aislados,-1,comunicacion
tiene algunos procesos sin secuencia logica no esta aplicado de forma correcta el extend en el caso de uso consultar automovil falta comunicacion entre casos de usos no han aplicado herencias entre actores,-1,procesos
no existe funcionalidad correcta de algunos procesos y el diagrama no cumple con todos los requerimientos del enunciado,-1,funcionalidad
la caratula sin errores ortograficos,1,caratula
existe mala comunicacion entre los actores y caso de uso algunos no cumplen con la sintaxis algunos casos de uso tienen islas y no estan ordenados,-1,comunicacion
la solucion tiene procesos sin secuencia logica,-1,solucion
no incluye algunos requerimientos descritos del casos de uso y no demuestran interaccion con algunos objetos,-1,requerimientos
excelente presentacion de la caratula contiene todos los elementos requeridos,1,presentacion
falto ubicar el codigo de orden a cada caso de uso pero si presenta un debido orden,0,codigo
algunos casos de uso no presenta una correcta secuencia logica por ejemplo el caso de uso generar informe no presenta logica alguna,-1,casos
las funcionalidades del diagrama de caso de uso presenta un incorrecto funcionamiento debido a el mal empleo de las asociaciones entre sus casos de uso y actores,-1,funcionalidades
si posee todos los parametros indicados en la caratula y no posee errores ortograficos,1,parametros
la estructura si posee todos los elementos y tiene una correcta sintaxis pero no estan ordenados los casos de uso dificultando el entendimiento,0,estructura
cumple con todos los procedimientos y secuencias logica si hay una correcta aplicacion de include y extend entre casos de uso,1,procedimientos
la solucion presentada si cumple con todos los requerimientos estipulados en el caso de estudio y los casos de uso si demuestran una correcta interaccion con los objetos,1,solucion
la caratula cumple con todos los nombres descritos en la rubrica ademas no posee errores ortograficos,1,caratula
el diagrama posee todos los elementos la sintaxis de todos los casos de uso es correcta exceptuando que no presenta el codigo de los casos de uso,0,diagrama
el proceso y la secuencia logica se cumplen totalmente,1,proceso
a los actores empleado y gerente le falta casos de uso para tener acceso al sistema no puede registrar a los usuarios no hay conexion entre registrar contrato_auto y consultar contrato_automovil,-1,actores
la caratula sin errores ortograficos,1,caratula
la estructura no fue lo suficientemente ordenada con la union de lineas,-1,estructura
no tiene herencia,-1,herencia
la autenticacion esta mal planteada,-1,autenticacion
la caratula cumple todos los requerimientos sin faltas de ortografia,1,caratula
las estructura se entiende pero pudo estar mas ordenada,0,estructura
se utilizaron correctamente todos los procesos,1,procesos
se cumplen con los requerimientos indicados,1,requerimientos
la caratula sin errores ortograficos,1,caratula
al diagrama le hace falta el codigo de caso de uso pero si es posible entender,0,diagrama
no tiene herencia,-1,herencia
el funcionamiento es correcto,1,funcionamiento
la caratula sin errores ortograficos,1,caratula
tiene la mayoria de los elementos no contiene codigo los casos de uso,0,mayoria
la mayoria de los procesos tienen secuencia logica el proceso de generar informe no tiene aplicado de forma correcta el extend en el caso de uso imprimir reporte,0,mayoria
la mayoria de los casos de usos tienen funcionalidad correcta y cumple con los requerimientos especificados el caso de uso generar informe tiene una funcionalidad incorrecta,0,mayoria
la caratula tiene errores ortograficos,-1,caratula
los casos de uso no contiene codigo y no existe ningun tipo de herencia,-1,casos
la secuencia logica es acertada y la aplicacion de include y extend funciona correctamente,1,secuencia
al no existir herencia entre actores no hay formas de que el empleado registre a un nuevo usuario para que pueda hacer el contrato no se encuentra la validacion de codigo de contrato para que el empleado puedo hacer el contrato no existen casos de uso para que el empleado pueda anular un contrato el gerente contiene dos casos de uso que pueden ser extraidos de casos de uso anteriores,-1,herencia
la caratula sin errores ortograficos,1,caratula
se visualizan casi todos los casos y estan bien dirigidas las flecha de los includes y extend,1,casos
en esta parte cumple con casi todo lo estipulado y no cuenta con herencia,0,parte
falta un genera contrato no cumple con todo lo estipulado en el caso practico,-1,contrato
la caratula contiene los datos correctos pero en el documento les falto colocar la numeracion del enunciado del problema,0,caratula
la elementos se visualiza correctamente aplicaron bien la sintaxis entre los caso de uso pero no estan ordenados,0,elementos
la solucion de ellos tienen la mayoria de los requerimientos y secuencia logica,1,solucion
incluye todos los requerimientos del caso de uso y existe funcionalidad entre los objetos,1,requerimientos
la caratula no tiene errores ortograficos,1,caratula
le falta llevar el orden en los casos de uso,-1,orden
los procedimientos son incorrectos,-1,procedimientos
si posee fuincionalidad pero hay que mejorar en las relaciones con los cu,0,fuincionalidad
la caratula esta totalmente adecuada describe los requerimientos de lo que se desea obtener sin errores ortograficos,1,caratula
el diagrama de caso de uso esta bastante adecuado contiene casi todos los casos de usos pero presenta errores en los objetos y no tiene aplicada la herencia,0,diagrama
el diagrama de caso de uso esta adecuado pero no se esta aplicando bien la herencia y el uso de include y extends,0,diagrama
el diagrama de caso de uso tiene funcionamiento de algunos de los requerimientos pero en el caso del gerente el no registra contrato,0,diagrama
la caratula no tiene errores ortograficos,1,caratula
cumple con los elementos una sintaxis correcta pero no se encuentran los codigos de caso de uso por prioridad,0,elementos
cumple con la mayoria de los procesos le falta herencia de los actores empleado y gerente y la secuencia logica se encuentra de una manera clara y entendible,1,mayoria
cumple con todos los requerimientos dados en el caso de uso y su funcionalidad tiene interacciones con los objetos dados,1,requerimientos
la caratula esta completa y el enunciado sin errores,1,caratula
la estructura se muestra bien clara sin errores de sintaxis pero se observa que no tiene el codigo de caso de uso,0,estructura
el procedimiento se observa bastante simple con aplicacion de includes y nula aplicacion de extends ademas de que algunos casos de usos terminan sin algun proceso,0,procedimiento
la funcionalidad podria darse correctamente pero no abarca todos los requerimientos,0,funcionalidad
el documento consta de todo lo necesario dentro de la caratula y asi mismo no contiene errores ortograficos en el contenido mostrando una buena presentacion,1,documento
dentro de la estructura no contiene todos los elementos esta incompleto mostrando la falta de aplicacion de herencia codigos de caso de uso y eso muestra un desorden dentro de lo que se desea mostrar,-1,estructura
en el procedimiento se indica que no se hace uso de la aplicacion del extend aunque no es obligatorio es recomendable al menor tener uno o dos,-1,procedimiento
no incluye todos los requerimientos del caso de uso pero los casos de uso mostrando si tienen una funcionalidad de algunos requerimientos,0,requerimientos
en la caratula le falto poner la carrera en que estudia,-1,caratula
le falto los codigos de asignacion,-1,codigos
aplica bien los include y la herencia pero falto mas logica,0,include
en el funcionamiento hace include de algo que no se a registrado,-1,funcionamiento
la caratula tiene errores ortograficos,-1,caratula
en los casos de usos no existe el codigo de prioridad que lo identifique,-1,casos
no existe la aplicacion de extend entre los casos de usos no hay una secuencia logica entre el gerente y los casos de usos consultar usuario consultar automovil y consultar furgoneta,-1,aplicacion
no existe la funcionalidad de gestionar las altas y bajas de los vehiculos por parte del gerente por lo tanto no hay una secuencia logica ya que no se puede reservar un automovil si no existe un registro anterior,-1,funcionalidad
la caratula tiene errores ortograficos,-1,caratula
si cumple con la secuencia y indica cada caso de uso con verbo  objeto,1,secuencia
no tiene ningun extend no tiene su respectivo codigo generar reserva deberia ser extend y en el cliente no se puede eliminar una reserva sin antes haberla consultado,-1,ningun
el funcionamiento es parcialmente correcto el gerente debe consultas informes tambien,0,funcionamiento
la caratula tiene errores ortograficos,-1,caratula
las estructura se entiende y esta ordenada,1,estructura
falta implementar herencia,-1,herencia
el funcionamiento es parcialmente no es correcto no hay validacion para saber si el usuario ya esta logueado,-1,funcionamiento
la caratula no contiene el nombre de la carrera ni del trabajo entregado y su enunciado consta con menos de  errores ortograficos,-1,caratula
muestra la mayoria elementos aunque usa objetos que no estan previamente creados no usa la sintaxis correcta para describir los casos de uso y tampoco se le ha colocado sus respectivos codigos por lo cual no se encuentran ordenados la herencia entre actores no cumplen con los requerimientos solicitados,-1,mayoria
como se menciona anteriormente la herencia no esta aplicada de forma correspondiente con los requerimientos y no hace uso del extend y existen errores en la aplicacion de los casos de uso porque no se tiene claro que hace el cliente y el empleado,-1,herencia
el funcionamiento presenta varios errores motivo por el cual la solucian tiene una funcionalidad incorrecta de algunos de los requerimientos descritos en el caso de estudio,-1,funcionamiento
el documento contiene falta ortografica en la fecha del periodo academico el documento no contiene el tema del trabajo,-1,documento
el documento no contiene los codigos de sus respectivos casos de usos,-1,documento
el documento no cumple con los requerimientos del uso del extends,-1,documento
el documento obtiene la solucion de una manera concreta,1,documento
la caratula no tiene errores ortograficos,1,caratula
tiene alguno de los elementos le falta codigo en los casos de uso no esta ordenado,0,elementos
la mayoria de los procesos no tienen secuencia logica y aplican objetos diferentes lo que no permite una buena comunicacion entre casos de uso existe aplicacion de incluye de forma incorrecta,-1,mayoria
la mayoria de los casos de usos tienen funcionalidad incorrecta y no cumple con los requerimientos especificados,-1,mayoria
en este parte no cumple con todo lo que estipula en el archivo falta nombre de carrera y error de al escribir el periodo,-1,parte
se visualizan casi todos los casos la aplicacion de include es incorrecto y no existen extend,-1,casos
en la parte del caso de uso generar reserva y consultar codigo esta de mas y estan realizando una cadena de includes,-1,parte
falta en la parte del gerente dar alta y baja a la flota y parte del cliente falta el autenticar no cumple con todo lo estipulado en el caso practico,-1,parte
la caratula tiene errores ortograficos,-1,caratula
los casos de uso no cuenta con codigo y utiliza mal la flecha de herencia,-1,casos
solo aplica include y herencia,0,aplica
el funcionamiento es correcto,1,funcionamiento
la caratula presenta errores no contiene nombre de la carrera ni tema del trabajo el periodo academico existe error en el ano academico,-1,caratula
no contiene el uso de extends ni herencia los casos de usos no tienen codigo y por ende no tiene orden,-1,uso
la aplicacion del include presenta errores al invocar casos de usos en los cuales se deberian usar extends para enviar informacion lo cual da a entender que no tiene una secuencia logica,-1,aplicacion
el caso de uso no tiene funcionamiento el caso de autor gerente le faltan la funcionalidad de dar de alta y baja,-1,caso
no contiene el nombre de la carrera ni el tema,-1,nombre
se visualiza una sintaxis correcta no contienen los codigos de caso de uso por prioridad,0,sintaxis
cumple con los procesos include y extend y una herencia y estan conectados por una secuencia correcta a excepcion de un caso de uso en el actor gerente donde se encuentra un caso de uso no interactua con ninguno,1,procesos
cumple con los requerimientos dados en el caso de uso y su funcionalidad tiene interacciones con los objetos dados a excepcion de generar_informe porque se encuentra solo y no especifica que necesita hacer,1,requerimientos
la caratula cuenta con todo lo requerido y el enunciado esta comprensible y sin errores ortograficos,1,caratula
el diagrama cuenta con todos los elementos pero en la sintaxis los casos de uso no tiene codigo por lo que dificulta un poco el entendimiento del diagrama,0,diagrama
cuando el cliente autentica usuario invoca a una consulta por lo que no le veo un registro de cliente,-1,cliente
la funcionalidad del diagrama no muestra algunas cosas que se piden en los requerimientos como por ejemplo cancelar la reserva,-1,funcionalidad
la caratula esta complete y el enunciado esta bien detallado,1,caratula
los casos de uso no cuenta con un codigo y el entendimiento es un poco complicado no esta ordenado,-1,casos
su secuencia logica esta bien definida con las comunicaciones de caso de uso,1,secuencia
el diagrama cumple con la mayoria de los requerimientos que el sistema requiere como el de gestionar reserva y registrar con un contrato,1,diagrama
la caratula no tiene errores ortograficos,1,caratula
existe una buena comprension del caso de uso debido a que se encuentran la mayorias de elementos descritos en el caso de estudio,1,comprension
la mayoria de los procesos cuentan con una secuencia logica al empleado le falta introducir el codigo de la reserva para registrar con exito un contrato,1,mayoria
la gran parte de los requerimientos cumple una funcionalidad idonea en base al caso de estudio,1,parte
la caratula cumple con todos los nombres descritos en la rubrica y ademas no posee errores ortograficos,1,caratula
el diagrama posee todos los elementos la sintaxis de todos los casos de uso es correcta exceptuando que no presenta el codigo de los casos de uso,0,diagrama
el proceso se cumple correctamente pero flaquea en la logica de algunos casos de uso,0,proceso
algunos casos de uso tienen diferente verbos al momento de realizar include tiene la mayoria de requerimientos,0,casos
la caratula consta de exceso de contenido mas de lo pedido el enunciado no contiene errores ortograficos,0,caratula
la estructura es facil de comprender la sintaxis no esta muy clara existen sentidos de flechas incorrectos y no se encuentra ordenado ya que no cuenta con el codigo en el objeto,-1,estructura
en el proceso de aplicar include existen incoherencia en la aplicacion la secuencia logica si esta clara,-1,proceso
no incluye todos los requerimientos del caso de estudio existen casos que no demuestran funcionalidad con el actor,-1,requerimientos
la caratula no tiene errores ortograficos,1,caratula
no tiene el codigo de caso de uso,-1,codigo
la solucion presentada tiene pocos procesos con secuencia logica,-1,solucion
el diagrama muestra todos los requisitos solicitados,1,diagrama
la caratula cumple todos los requerimientos sin faltas de ortografia,1,caratula
las estructura se entiende pero esta muy desordenada,0,estructura
falta implementar herencia y mas extends,-1,herencia
se cumplen con los requerimientos indicados,1,requerimientos
la caratula y el enunciado esta bien detallado como se pide en la rubrica de calificacion,1,caratula
al diagrama le hace falta el codigo de caso de uso pero si es posible entender,0,diagrama
algunos casos de uso que aplican include no tienen concordancia con respecto al objetos multiples objetos,-1,casos
si cumple con la mayoria de los requerimientos de forma correcta,1,mayoria
contiene caratula y enunciado correcto,1,caratula
tiene algunos elementos le falta codigo en los casos de uso la comunicacion entre algunos casos de uso es incorrecta,0,elementos
algunos procesos tienen secuencia logica el proceso registrar contrato no tiene secuencia logica,0,procesos
algunos casos de usos tienen funcionalidad correcta y cumple con los requerimientos especificados,0,casos
la caratula cumple con todos los requerimientos descritos en la rubrica y ademas no contiene errores ortograficos,1,caratula
los casos de estudio no contiene su respectiva numeracion para poder diferenciarlos,-1,casos
existen casos de uso que tienen include con las flechas en direccion contraria,-1,casos
el empleado no tiene un caso de uso para poder registrar a un nuevo usuario  ademas no hay casos de uso para que el empleado valide el codigo de reserva web de los vehiculos,-1,empleado
la caratula tiene la estructura adecuada,1,caratula
se visualizan todos los casos de uso tienen bien los include y extend pero no tienen el codigo del cada caso de uso,0,casos
en la parte de crear usuario es incorrecto deberia consultar para validar el usuario,-1,parte
falta en la parte del gerente dar alta y baja a la flota y parte del cliente falta cancelar reserva no cumple con todo lo estipulado en el caso practico,-1,parte
la caratula no tiene errores ortograficos,1,caratula
a la estructura le falta secuencia y no posee el orden en los casos de uso,-1,estructura
la solucion presentada tiene pocos procesos con secuencia logica,-1,solucion
falta mejorar el funcionamiento de los casos de uso,-1,funcionamiento
la caratula esta totalmente adecuada describe los requerimientos de lo que se desea obtener sin errores ortograficos,1,caratula
el diagrama de caso de uso esta bastante adecuado contiene casi todos los casos de usos,1,diagrama
el diagrama de caso de uso tiene la mayoria de los procesos de forma correcta y se estan aplicando bien la herencia y el uso de include y extends,1,diagrama
el diagrama de caso de uso tiene funcionamiento pero en el caso del gerente le falta la funcionalidad de dar de baja,0,diagrama
la caratula tiene la estructura adecuada,1,caratula
se visualiza una sintaxis correcta pero no contienen los codigos de caso de uso,0,sintaxis
cumple con los procesos include extend y una herencia correcta y estan conectados por una secuencia correcta,1,procesos
cumple con los requerimientos dados en el caso de uso y su funcionalidad tiene interacciones con todos los objetos,1,requerimientos
la caratula cumple con todos los parametros requeridos para la presentacion del trabajo y el documento cuenta con el enunciado de los requerimientos que describe la ejecucion del trabajo no existen errores ortograficos observacion debido a que el documentos esta impreso en bn algunos elementos del documento son complicados de leer,1,caratula
los casos de uso cumplen con la sintaxis de verbo en infinitivo  objeto no existen codigos para cada caso de uso por lo que no se determina una secuencia u orden de casos de uso no se aplica herencia existe una isla,-1,casos
se aplica los estereotipos includes y extends de manera correcta entre casos de uso no existe aplicacion de herencia entre actores,0,estereotipos
una de las funcionalidades registrar informes esta asociada con el actor incorrecto empleado quien hace los informes es el gerente y no especifica sobre que realiza los informes existe una isla,-1,funcionalidades
el documento no tiene la facultad  tampoco la carrera ni el tema del trabajo,-1,documento
no tiene un orden de codigo ni comunicacion entre todos los actores ,-1,orden
